Product,Use,Price,Link
Bread Board, To connect things, $5.89, https://www.amazon.com/gp/product/B09NS36955/ref=ox_sc_act_image_1?smid=A1CV2ETGSPQEB3&psc=1
Servo, To push pencils out or open compartment to let them out, $6.99, https://www.amazon.com/gp/product/B0BKPL2Y21/ref=ox_sc_act_title_2?smid=A1YZW40LYQY3L1&th=1
PIR Sensor, To detect when you are waving/putting your hand over the dispenser, $5.99, https://www.amazon.com/gp/product/B09MM3HDBK/ref=sw_img_1?smid=A3CX4TQNUXMB0L&th=1
Arduino Uno, To connect the PIR sensor and servo and to program all of the electronics, $5.89, https://www.amazon.com/gp/product/B0DSC4Q1J9/ref=ox_sc_act_title_3?smid=AGBPQLQT372PL&th=1
6V AA battery holder, To power the Arduino and PIR sensor and Servo, $6.99, https://www.amazon.com/gp/product/B08XNVCB5T/ref=ox_sc_act_title_1?smid=A1A96JMJTF057G&psc=1
